long,racial_group,index,unclear,correct
the colored soldier in this army is fighting merely because he has to and not because he wants to. this is our first big . no unity between our white and colored fighting faces. the other countries usually only and  and they are all together and therefore get more unity which is the primary factor in making this war. i don't [unclear]feel[/unclear] i am being treated right my company don't feel their(sic) being treated right . they dislike their (sic) company commander very much. therefore if we went their (sic) would be no unity and most of us would never get back for lack of teamwork and this happening in many places can lose the war. most colored c.o. are in the infantry or some other combat units never any place where he can show his skill by using his head. the colored soldier in this army is fighting mearly because he has to and not because he wants to. this is our first big . no unity between our white and colored fighting forces. the other countries usually have only one race and they are all together and therefore get more unity which is the primary factor in winning this war. i don't fill i am being treated right my comany don't feel thier being treated right. they dislike thier company commander very much. therefore if we went [unclear]cra???s[/unclear] their would be no unity and most of us would never get back for lack of team work and this happening in many places can lose the war. most colord c.o. are in the infantry or some other combat unit never any place where he can show his skills by using his head.,black,1981,[unclear]feel[/unclear],feel
the colored soldier in this army is fighting merely because he has to and not because he wants to. this is our first big . no unity between our white and colored fighting faces. the other countries usually only and  and they are all together and therefore get more unity which is the primary factor in making this war. i don't [unclear]feel[/unclear] i am being treated right my company don't feel their(sic) being treated right . they dislike their (sic) company commander very much. therefore if we went their (sic) would be no unity and most of us would never get back for lack of teamwork and this happening in many places can lose the war. most colored c.o. are in the infantry or some other combat units never any place where he can show his skill by using his head. the colored soldier in this army is fighting mearly because he has to and not because he wants to. this is our first big . no unity between our white and colored fighting forces. the other countries usually have only one race and they are all together and therefore get more unity which is the primary factor in winning this war. i don't fill i am being treated right my comany don't feel thier being treated right. they dislike thier company commander very much. therefore if we went [unclear]cra???s[/unclear] their would be no unity and most of us would never get back for lack of team work and this happening in many places can lose the war. most colord c.o. are in the infantry or some other combat unit never any place where he can show his skills by using his head.,black,1981,[unclear]cra???s[/unclear],
none about white and negro [unclear]mixed[/unclear] it a very good ideal so they can get to no one another before going over hear and in the southern states there are not [unclear]face[/unclear] to to negroes soldiers at all in camp they are to [unclear]confined[/unclear] and they should station all soldiers as near home as possible and i think they will like army life more better and i seen in army 4 month can't even get a furlough plenty of us white boy are getting less time than 2 month so the army is not fair at all to negro soldiers. p.s. white boys have barracks negro have tent. do you think that fair at all no so the army is hell toward negro soldiers.,black,2015,[unclear]mixed[/unclear],mixed
none about white and negro [unclear]mixed[/unclear] it a very good ideal so they can get to no one another before going over hear and in the southern states there are not [unclear]face[/unclear] to to negroes soldiers at all in camp they are to [unclear]confined[/unclear] and they should station all soldiers as near home as possible and i think they will like army life more better and i seen in army 4 month can't even get a furlough plenty of us white boy are getting less time than 2 month so the army is not fair at all to negro soldiers. p.s. white boys have barracks negro have tent. do you think that fair at all no so the army is hell toward negro soldiers.,black,2015,[unclear]face[/unclear],face
none about white and negro [unclear]mixed[/unclear] it a very good ideal so they can get to no one another before going over hear and in the southern states there are not [unclear]face[/unclear] to to negroes soldiers at all in camp they are to [unclear]confined[/unclear] and they should station all soldiers as near home as possible and i think they will like army life more better and i seen in army 4 month can't even get a furlough plenty of us white boy are getting less time than 2 month so the army is not fair at all to negro soldiers. p.s. white boys have barracks negro have tent. do you think that fair at all no so the army is hell toward negro soldiers.,black,2015,[unclear]confined[/unclear],confined
our food is no good down here and work is hard and we do all the shite part of it they mack us do it and we have to do it or we go to jall house and we will not get our pay and down here is no good for the nortern [unclear]man han[/unclear],black,2033,[unclear]man han[/unclear],man
why do the white have  an the negros have wooden heels with no skrings an while have steam heat barracks white have a uso club on the post an negros have to go 49 miles for any fun when have dance in 023 eng they only issue about 20 passes to the 24th [unclear]ann sq.[/unclear] i thank all negros soldiers should be in the north because in the south they run the camp as they do the cities an a collerd soldier have go to the back  an dont have any place collerd to go to have a nice time an is treated like a dog by the white an army dont have any thing to do with it an are call niggers by all.,black,2034,[unclear]ann sq.[/unclear],
when this war is over i like to have a better chance to live and a better chance to work and a better and fair chance to make a decent living in the united states of the white boys have bed to sleep on but we negros have wood bed to sleep on with no spring. the uso is 60 miles from camp and the 24 [unclear]aun sg (sep) [/unclear]have no way to get there expet on the but when the but is not full of white soldier,black,2038,[unclear]aun sg (sep) [/unclear],
i don't think a negro has as good a chance for any kind of a office in of out of the u.s. army. if he get anything worth while in or out of the army he has to put up a fight for it. the white can get most anything they ask for. negros goes through a lot of [unclear]effenese[/unclear] for difficult jobs and still don't get them. a white man gets the job that doesn't have the ability the negro does.,black,2045,[unclear]effenese[/unclear],offenses
if we have colored troops overseas i would like to hear why there isn't a colored general over there to command them?  why colored soldiers have been [unclear]located[/unclear] in [unclear]the[/unclear] southwest  nothing have been done about it colored soldiers who are supposed to be fighting for this country. when things like this happen it makes a colored soldier feel like he don't have any thing to fight for.  why is it that colored troops haven't got uso clubs at all their camps. the uso club will keep up the morale up.  why is it compulsary to take out insurance?  why the colored soldiers can't wear  hats?  why colored soldiers can't ride the same as white soldiers down south. they have to ride in the rear of busses in special trains and taxis.  why can't they have special service trains to take soldiers home on week-ends and get him back on time for reveille monday morning?  why don't we have a colored war-correspondent?,black,2061,[unclear]located[/unclear],located
if we have colored troops overseas i would like to hear why there isn't a colored general over there to command them?  why colored soldiers have been [unclear]located[/unclear] in [unclear]the[/unclear] southwest  nothing have been done about it colored soldiers who are supposed to be fighting for this country. when things like this happen it makes a colored soldier feel like he don't have any thing to fight for.  why is it that colored troops haven't got uso clubs at all their camps. the uso club will keep up the morale up.  why is it compulsary to take out insurance?  why the colored soldiers can't wear  hats?  why colored soldiers can't ride the same as white soldiers down south. they have to ride in the rear of busses in special trains and taxis.  why can't they have special service trains to take soldiers home on week-ends and get him back on time for reveille monday morning?  why don't we have a colored war-correspondent?,black,2061,[unclear]the[/unclear],the
i dont get furlough often a [unclear]month[/unclear],black,2069,[unclear]month[/unclear],month
frankly speaking thinking the negros should be given a even chance in the [unclear]war[/unclear] jobs. and other jobs such as the motor [unclear]tronisent[/unclear] lines in the city and for our negro troops should be given a chance to show what they can do in the air corp. and for the army i think my regiment can [unclear]equally[/unclear] any [unclear]combat[/unclear] [unclear]outfit[/unclear] in the service i really think that the solider in the south should be given a better chance than they get. i think the law should take some part in to see that the colored solider shot down in [unclear]these[/unclear] uniform on the streets like dogs and also riding buses they will have to ride the back seats. frankly i think a solider should be treated as citizens no matter where he go. of course i know it will take some time to prove to those illiterate white people down there that negro are part of this democracy to.,black,2070,[unclear]war[/unclear],war
frankly speaking thinking the negros should be given a even chance in the [unclear]war[/unclear] jobs. and other jobs such as the motor [unclear]tronisent[/unclear] lines in the city and for our negro troops should be given a chance to show what they can do in the air corp. and for the army i think my regiment can [unclear]equally[/unclear] any [unclear]combat[/unclear] [unclear]outfit[/unclear] in the service i really think that the solider in the south should be given a better chance than they get. i think the law should take some part in to see that the colored solider shot down in [unclear]these[/unclear] uniform on the streets like dogs and also riding buses they will have to ride the back seats. frankly i think a solider should be treated as citizens no matter where he go. of course i know it will take some time to prove to those illiterate white people down there that negro are part of this democracy to.,black,2070,[unclear]tronisent[/unclear],transport
frankly speaking thinking the negros should be given a even chance in the [unclear]war[/unclear] jobs. and other jobs such as the motor [unclear]tronisent[/unclear] lines in the city and for our negro troops should be given a chance to show what they can do in the air corp. and for the army i think my regiment can [unclear]equally[/unclear] any [unclear]combat[/unclear] [unclear]outfit[/unclear] in the service i really think that the solider in the south should be given a better chance than they get. i think the law should take some part in to see that the colored solider shot down in [unclear]these[/unclear] uniform on the streets like dogs and also riding buses they will have to ride the back seats. frankly i think a solider should be treated as citizens no matter where he go. of course i know it will take some time to prove to those illiterate white people down there that negro are part of this democracy to.,black,2070,[unclear]equally[/unclear],equal
frankly speaking thinking the negros should be given a even chance in the [unclear]war[/unclear] jobs. and other jobs such as the motor [unclear]tronisent[/unclear] lines in the city and for our negro troops should be given a chance to show what they can do in the air corp. and for the army i think my regiment can [unclear]equally[/unclear] any [unclear]combat[/unclear] [unclear]outfit[/unclear] in the service i really think that the solider in the south should be given a better chance than they get. i think the law should take some part in to see that the colored solider shot down in [unclear]these[/unclear] uniform on the streets like dogs and also riding buses they will have to ride the back seats. frankly i think a solider should be treated as citizens no matter where he go. of course i know it will take some time to prove to those illiterate white people down there that negro are part of this democracy to.,black,2070,[unclear]combat[/unclear],combat
frankly speaking thinking the negros should be given a even chance in the [unclear]war[/unclear] jobs. and other jobs such as the motor [unclear]tronisent[/unclear] lines in the city and for our negro troops should be given a chance to show what they can do in the air corp. and for the army i think my regiment can [unclear]equally[/unclear] any [unclear]combat[/unclear] [unclear]outfit[/unclear] in the service i really think that the solider in the south should be given a better chance than they get. i think the law should take some part in to see that the colored solider shot down in [unclear]these[/unclear] uniform on the streets like dogs and also riding buses they will have to ride the back seats. frankly i think a solider should be treated as citizens no matter where he go. of course i know it will take some time to prove to those illiterate white people down there that negro are part of this democracy to.,black,2070,[unclear]outfit[/unclear],outfit
frankly speaking thinking the negros should be given a even chance in the [unclear]war[/unclear] jobs. and other jobs such as the motor [unclear]tronisent[/unclear] lines in the city and for our negro troops should be given a chance to show what they can do in the air corp. and for the army i think my regiment can [unclear]equally[/unclear] any [unclear]combat[/unclear] [unclear]outfit[/unclear] in the service i really think that the solider in the south should be given a better chance than they get. i think the law should take some part in to see that the colored solider shot down in [unclear]these[/unclear] uniform on the streets like dogs and also riding buses they will have to ride the back seats. frankly i think a solider should be treated as citizens no matter where he go. of course i know it will take some time to prove to those illiterate white people down there that negro are part of this democracy to.,black,2070,[unclear]these[/unclear],their
think the army is a good set up but some time the food is shy could anything be done about it and the cleaning [unclear]eqreement[/unclear] is poor in this camp could it be looked after. these are certain things needed looking after where are the officers in charge.,black,2091,[unclear]eqreement[/unclear],equipment
it has been said the negroes were fightin for  same thing as the wwhite people so why should it be that we hafter to stay one place and they stay a nother. it has been said no [unclear]democery[/unclear] [democracy] but it plenty of that here. we should have a eagle break with the white man we are fighting for the same thing they are fighting they say.,black,2092,[unclear]democery[/unclear],deomcracy
"i as an individual soldier will here say my opinion of this camp as ft mcclellan, ala. in the first place the negro soldiers have a rotten inconvenient transportation. i've been here almost a complete cycle and they haven't cleaned or changed my blankets. although i realize that i am a soldier and that i am not home or not to live on ""flower beds of [unclear]illegible[/unclear]. so far as doing my part i think that i am really doing that. i would very much like to be a non-com and also a commissioned officer if i possibly could and sent to some better camp either in the north or some camp in the west.",black,2096,[unclear]illegible[/unclear],
i am 39 and perfectly willing to give my all. i feel that my legs won't stand the hard training we have to go through for i suffer from [unclear]rhomatism[/unclear] and shortage of wind. otherwise i don't mind the army one bit. it's a fine place for building men up with me it just isn't here.,black,2098,[unclear]rhomatism[/unclear],rheumatism
no excuse except i want to get out of alabama and also the south. i can soldier much better in the north we cant get poorer here i would like to go to town some time but they wont let me thats the [unclear]reason[/unclear] we  go a week.,black,2118,[unclear]reason[/unclear],reason
i haven't anything to say i don't [unclear]reckon[/unclear] what to say,black,2131,[unclear]reckon[/unclear],reckon
the dispensary service is rotten. gave aspirin [unclear]had[/unclear] rheumatic fever. soldiers hardly have any leisure time.,black,2134,[unclear]had[/unclear],had
i want to know why they keep disabled men in the army? i was inducted when sick & i want to know if i can get some [unclear]income[/unclear] from the government?,black,2135,[unclear]income[/unclear],income
"i think this war is being fought on equal terms but as far as things being different between races i believe we are having it but as i can recall it was said there would not be any. but it is for instance, we was passing a camp one day on a march and i noticed a building ( a latrine) and on one side it said for (white) and around (back it said (colored) well the soldiers didn't like it very much and [unclear] raived [/unclear] about it and on the buses dow here they have some marked for colored and some for whites and even any where a colored soilder may go you see signs for colored and signs ( for white and i don't believe it is right because we are all fighting for the same thing and our life and country is just as dear to me as the next mans is. so i don't think it is any more than fair to share the same things . if you send home the boys much for kicking against certain things and if some things was changed us colored boys would feel a lot better about fighting than they do.",black,2159,[unclear] raived [/unclear],raved
we negros want to fight. for better if it won't be. better we stop now if it don't be better hell with it the [unclear] is [/unclear] but his will don't go out the [unclear] is hell for negro [unclear] i am [/unclear] of it what are we fighting for long if it don't be better for negro i don't give a damn [/unclear] it [unclear] it be better [/unclear] fight but i don't want to fight for the white only. so this is all i have to say if it aint better for the negro i don't give a god dam so that is all,black,2160,[unclear] is [/unclear],
we negros want to fight. for better if it won't be. better we stop now if it don't be better hell with it the [unclear] is [/unclear] but his will don't go out the [unclear] is hell for negro [unclear] i am [/unclear] of it what are we fighting for long if it don't be better for negro i don't give a damn [/unclear] it [unclear] it be better [/unclear] fight but i don't want to fight for the white only. so this is all i have to say if it aint better for the negro i don't give a god dam so that is all,black,2160,[unclear] is hell for negro [unclear] i am [/unclear],
we negros want to fight. for better if it won't be. better we stop now if it don't be better hell with it the [unclear] is [/unclear] but his will don't go out the [unclear] is hell for negro [unclear] i am [/unclear] of it what are we fighting for long if it don't be better for negro i don't give a damn [/unclear] it [unclear] it be better [/unclear] fight but i don't want to fight for the white only. so this is all i have to say if it aint better for the negro i don't give a god dam so that is all,black,2160,[unclear] it be better [/unclear],it be better
the only thing that i dont [don't] like about the [unclear]rep****[/unclear] when you go there they dont [don't] seem to want to help a person they just give him something look like to me to get him off thire [their] hand thats the only thing i dont like,black,2162,[unclear]rep****[/unclear],
"i think it will be better to let some head man to see this, probably he will try to do something to get me out of this army and let me return back home and make my living by farming, for that is all i ever done in my hole life and i want to remain farming for my living. it is more [unclear] pleasant? [/unclear] on a farm than it is in the army, because we don't have nothing to fight for they othen to sen the farmers back for to suport supply for the army. if they was going to draft negros thay orter get all out of these large towns and left all farmers their to continue to farm.",black,2163,[unclear] pleasant? [/unclear],pleasant
"the servise thhe boys here in camp get is hell when we go to town and try to get on the bus the white m.p. will make us stand back and wait till the white get on the busses on one occasion i [unclear]alus member[/unclear] i and some more soldiers were trying to get back in camp and they had standing room on the buss only and the white m.p. would not let any colord soldiers get own he only let the white civilians own the bus and he knew that the soldiers had to be in camp for role call at 6 oclock that morning they just dont do the colord peoples right, in the south you cant sat beside white peoples own the busses  yet they say we is fighti ng for rights is that right, man is man where ever he is that what i though.",black,2166,[unclear]alus member[/unclear],
"as i have said if the negro was given a change to feel that he was being given an equal brake, both in civil and army life, he could do a much better job. i think the u.s. army should have all the people or soldiers as we might call it in one body, by this i mean, the white, chinese, negro and [unclear]us soldiers each [/unclear]in one body and then divide the talents not races. if we as negroes was made to feel this way we could get the job done in a hurry. not only do i feel this way but the average negro soldier does. in my company i don't think we or i am being given a chance to prove myself and show my dignity. i find that also the officers give only those people ratings that can curse the loudest and insult effectively, and not that person that know how to get things done. i sometime would prefer the guardhouse rather than the barrack, and there are many more like me.",black,2167,[unclear]us soldiers each [/unclear],us soldiers each
"the comments that i have is this: there are to much [unclear]grincion[/unclear] in the south, as a whole the white people think that they are better then the negros, but still they want the negro to help them fight. i believe that before theis war is ours there will be a war between the races.",black,2179,[unclear]grincion[/unclear],
"in my opinion, discrimination is the main thing that confronts the negro soldier and officer. there are places ""off limits"" to him on posts, camps & stations merely because he is a ""negro"" and he knows it. as long as this exists, you will never be able to get his whole hearted cooperation. as for combining negro and white, in my opinion, this takes a lot of thought. there are negros who can llive and work with anyone and there are some who can't. don't forget, there are also white people the same way. a lot of negros i have seen actually lose their tongue & [unclear]speech[/unclear] when a white person speaks to them, some of these negros couldn't be forced to live with white soldiers or people. there there are some who would be entirely at ease.  one remedy i have to mention is put as many negro officers in charge of negro soldiers as possible. try to make it 100 per cent.",black,2188,[unclear]speech[/unclear],speech
i try to get along with all and do think i can and will keep trying to and hope we all live a long time  [unclear]your[/unclear]  from,black,2189,[unclear]your[/unclear],
