long,racial_group,index,unclear,correct
why is it that the negro dont have the the [unclear]arites[/unclear] as the white soldier in traveling around in towns as the white when they all are just the same so far as brotherhood is consurn,black,4,[unclear]arites[/unclear],rights
i would like to all negro lt i believe [unclear]wyl [/unclear]will be treated better,black,52,[unclear]wyl [/unclear],while
"the only thing i'm waiting for is [unclear]duration[/unclear] and 6 mos.[months]  this survey is a good thing, but as usual any thing concerning a negro is never looked into as it should- so this seems like a waste of time.  every thing i said is my opinion only if i could come true i might like the army",black,55,[unclear]duration[/unclear],duration
i don't think that it should make any difence between the human race the negro are as good as the and the white are the same tea ll are fighting for the same causes negroes should be treated the same  as thier   nigro soldies are treated very  from the north  neather have i argud officers then write  from the negro  be treated but  should be treated like white peaples after all [unclear][/unclear[unclear]][/unclear] at stake as will at the white man that is my idear,black,73,[unclear][/unclear[unclear]][/unclear],
well we dont to fight. but we have to fight and we work hard to fight. i would [unclear]like[/unclear] to be in all negro outfit and no white at all we [unclear]like[/unclear] and we cant i due to part well i don't like the army at all,black,75,[unclear]like[/unclear],like
well we dont to fight. but we have to fight and we work hard to fight. i would [unclear]like[/unclear] to be in all negro outfit and no white at all we [unclear]like[/unclear] and we cant i due to part well i don't like the army at all,black,75,[unclear]like[/unclear],like
my only comment is that the negro and the white [unclear]race[/unclear] be on the same base one for all and all for one.,black,112,[unclear]race[/unclear],race
i dont like this camp here for i cannot stand this[unclear]calm[/unclear],black,114,[unclear]calm[/unclear],calm
when we speak of america we dont think of color. i my self as an american born negro is a believer in the doctoring of the great president a lincoln. a government for its people by its people shall not perish from this earth. 76  when you have people of two or more [unclear] colors [/unclear] it create fricton it wont work the average negro is happy as it is.,black,118,[unclear] colors [/unclear],colors
you didn't have any thing about the [unclear]east[/unclear] on no. 12 so i put east down,black,122,[unclear]east[/unclear],east
the [unclear]powers[/unclear] given to 1st sgt [sergeant] should be definitely stated on paper. the privelige of speaking to the c.o. [commanding officer] should not be denied the soldiers by 1st sgt.i think that [unclear]gov[/unclear] [government] should pay allotments as the money is taken out of monthly pay.this camp is too far from civilization.negro soldiers are not trained properly. they are not issued enough practice ammunition.,black,126,[unclear]powers[/unclear],powers
the [unclear]powers[/unclear] given to 1st sgt [sergeant] should be definitely stated on paper. the privelige of speaking to the c.o. [commanding officer] should not be denied the soldiers by 1st sgt.i think that [unclear]gov[/unclear] [government] should pay allotments as the money is taken out of monthly pay.this camp is too far from civilization.negro soldiers are not trained properly. they are not issued enough practice ammunition.,black,126,[unclear]gov[/unclear],government
we will be glad when the war is ending so we can get back free a [unclear]agane[/unclear],black,131,[unclear]agane[/unclear],again
it too [unclear]bad[/unclear] it [unclear]hapend[/unclear]  a war every twenty years  [unclear]but[/unclear] i gess it  right  i hope this will be the last war  as far as my [unclear]consurn[/unclear]  i hope thing will be better after the war do you think it right for me to fight in this war  will maybe i will have a better break after the war i hope  i hope this war will soon be over  we could hury and go home and get mary,black,132,[unclear]bad[/unclear],bad
it too [unclear]bad[/unclear] it [unclear]hapend[/unclear]  a war every twenty years  [unclear]but[/unclear] i gess it  right  i hope this will be the last war  as far as my [unclear]consurn[/unclear]  i hope thing will be better after the war do you think it right for me to fight in this war  will maybe i will have a better break after the war i hope  i hope this war will soon be over  we could hury and go home and get mary,black,132,[unclear]hapend[/unclear],happened
it too [unclear]bad[/unclear] it [unclear]hapend[/unclear]  a war every twenty years  [unclear]but[/unclear] i gess it  right  i hope this will be the last war  as far as my [unclear]consurn[/unclear]  i hope thing will be better after the war do you think it right for me to fight in this war  will maybe i will have a better break after the war i hope  i hope this war will soon be over  we could hury and go home and get mary,black,132,[unclear]but[/unclear],but
it too [unclear]bad[/unclear] it [unclear]hapend[/unclear]  a war every twenty years  [unclear]but[/unclear] i gess it  right  i hope this will be the last war  as far as my [unclear]consurn[/unclear]  i hope thing will be better after the war do you think it right for me to fight in this war  will maybe i will have a better break after the war i hope  i hope this war will soon be over  we could hury and go home and get mary,black,132,[unclear]consurn[/unclear],concern
i am very sorrow i cant put my name say i am a pvt [private] in the us army and i find no comments about the army only i am from the south and i [unclear]have[/unclear] my wife and kid up here with me and what i dont like is that some of the men can get passes good at all time and some cant. well here is what i think about it a man is a man a woman is a woman and one [unclear]should[/unclear] be aloud [allowed] no more than the other. they told me the first three grade are the only one to [unclear]get[/unclear] them. but that a lie because i no [know] better. i hope some one looking in to this pleas [please].hope to talk face to face with one of you some day soon[.] wish i cod [could] write name.,black,145,[unclear]have[/unclear],have
i am very sorrow i cant put my name say i am a pvt [private] in the us army and i find no comments about the army only i am from the south and i [unclear]have[/unclear] my wife and kid up here with me and what i dont like is that some of the men can get passes good at all time and some cant. well here is what i think about it a man is a man a woman is a woman and one [unclear]should[/unclear] be aloud [allowed] no more than the other. they told me the first three grade are the only one to [unclear]get[/unclear] them. but that a lie because i no [know] better. i hope some one looking in to this pleas [please].hope to talk face to face with one of you some day soon[.] wish i cod [could] write name.,black,145,[unclear]should[/unclear],should
i am very sorrow i cant put my name say i am a pvt [private] in the us army and i find no comments about the army only i am from the south and i [unclear]have[/unclear] my wife and kid up here with me and what i dont like is that some of the men can get passes good at all time and some cant. well here is what i think about it a man is a man a woman is a woman and one [unclear]should[/unclear] be aloud [allowed] no more than the other. they told me the first three grade are the only one to [unclear]get[/unclear] them. but that a lie because i no [know] better. i hope some one looking in to this pleas [please].hope to talk face to face with one of you some day soon[.] wish i cod [could] write name.,black,145,[unclear]get[/unclear],get
"i am a [unclear]mechanic[/unclear] i work on trucks and cars i like that and that is what is in me, i am a mortar man now but i don't want to be one i want to be a [unclear]mechanic[/unclear] and work on cars and truck",black,165,[unclear]mechanic[/unclear],mechanic
"i am a [unclear]mechanic[/unclear] i work on trucks and cars i like that and that is what is in me, i am a mortar man now but i don't want to be one i want to be a [unclear]mechanic[/unclear] and work on cars and truck",black,165,[unclear]mechanic[/unclear],mechanic
in regard to question 58; i have noticed that the white troops of the second branch of service as the negro have better equipment. to elaborate on no 4 i would like to say that the boys from the white medical [unclear]lletachments[/unclear] get a chance to work around the hospital and get practical experience but none of our boys get a chance although both white and colored are cared for in the same wards. in regard to question 57 i really believe the negro is doing more than his share,black,175,[unclear]lletachments[/unclear],detachments
"i don't think that a negro should be given more freedom in one section of the united states, [unclear]than[/unclear] he is in another. referencing mostly to the south.",black,181,[unclear]than[/unclear],than
the white off dont [unclear]treat[/unclear] the colored off right all so [unclear]they wasn't[/unclear] men and [unclear]treat right[/unclear] i was in white [unclear]p s could get wart [/unclear] one stay there a  how them made fun of me i am a soldier like them,black,191,[unclear]treat[/unclear],treat
the white off dont [unclear]treat[/unclear] the colored off right all so [unclear]they wasn't[/unclear] men and [unclear]treat right[/unclear] i was in white [unclear]p s could get wart [/unclear] one stay there a  how them made fun of me i am a soldier like them,black,191,[unclear]they wasn't[/unclear],they wasn't
the white off dont [unclear]treat[/unclear] the colored off right all so [unclear]they wasn't[/unclear] men and [unclear]treat right[/unclear] i was in white [unclear]p s could get wart [/unclear] one stay there a  how them made fun of me i am a soldier like them,black,191,[unclear]treat right[/unclear],treat right
the white off dont [unclear]treat[/unclear] the colored off right all so [unclear]they wasn't[/unclear] men and [unclear]treat right[/unclear] i was in white [unclear]p s could get wart [/unclear] one stay there a  how them made fun of me i am a soldier like them,black,191,[unclear]p s could get wart [/unclear],
"were they asked me would i like to go to another camp yes because my mother is sickly and cant get around. very much and i would like to be transferred to a closer camp in this fort you beg . lid off is transferred and won't get it bad the with fellows can go up to cmd. officer and asked for one and get it, we can't if we were given the same opportunity as the whites was we would be able to fight and think nothing of it, but as it is now we are thinking why fight because were being jim crowed and cant go every place the lights go. i want to get out of the army i could [unclear]go[/unclear] better in [unclear]civil m. [/unclear] life [unclear]li***[/unclear] going in other war plant lightning chat was",black,226,[unclear]go[/unclear],go
"were they asked me would i like to go to another camp yes because my mother is sickly and cant get around. very much and i would like to be transferred to a closer camp in this fort you beg . lid off is transferred and won't get it bad the with fellows can go up to cmd. officer and asked for one and get it, we can't if we were given the same opportunity as the whites was we would be able to fight and think nothing of it, but as it is now we are thinking why fight because were being jim crowed and cant go every place the lights go. i want to get out of the army i could [unclear]go[/unclear] better in [unclear]civil m. [/unclear] life [unclear]li***[/unclear] going in other war plant lightning chat was",black,226,[unclear]civil m. [/unclear],
"were they asked me would i like to go to another camp yes because my mother is sickly and cant get around. very much and i would like to be transferred to a closer camp in this fort you beg . lid off is transferred and won't get it bad the with fellows can go up to cmd. officer and asked for one and get it, we can't if we were given the same opportunity as the whites was we would be able to fight and think nothing of it, but as it is now we are thinking why fight because were being jim crowed and cant go every place the lights go. i want to get out of the army i could [unclear]go[/unclear] better in [unclear]civil m. [/unclear] life [unclear]li***[/unclear] going in other war plant lightning chat was",black,226,[unclear]li***[/unclear],
there is a lot of things wrong with the way they treat a colored soldier in the army. they don't have no places to go. ever thing is [unclear]tern cross for fear[/unclear] but the white soldiers can go any place. im saying this to try and get + have a better place for us boys to go wher we give off but we fair trying to get back to say sweet little girl. she means more to me than thier army. things will never change for us.,black,228,[unclear]tern cross for fear[/unclear],
the army as a whole is fairly good for this and  for one personal [unclear]sadness[/unclear] use and the other is very poor. i would like  to help my country in defence work much better . but otherwise where i am now & am satisfied very much much with my work and my comrades. such advancement is very very slow. thank you ,black,236,[unclear]sadness[/unclear],sadness
"i've been in the army 2 yrs. and almost 3 mo. and i'm sure i can be doing a better job than i am now. but i want to get out and into defense work where i'm more fitted to work my fingers to the bone for our sake -- ""the u.s.a."". and the reason for this opinion is obvious. i'd be better off! and i'd be doing my part as a citizen of these united states. there must be some privates in the army, but why me after countless thousands have come in after i and i volunteered of course because i like the army and i can teach them as well as some people they have made non-coms? i'm no mad man for money. but it is a bare necessity in the u.s.a. and i naturally want as much of it as possible to coordinate the other [unclear]meacities[/unclear] .",black,244,[unclear]meacities[/unclear],
"i don't think much of army life, it is [unclear]awful[/unclear] poor. colored soldiers   are usually  segregated on trains  as we have to [unclear]leave[/unclear] all southern state officers and only a few northern states. why do they put us out here in this [unclear]desert[/unclear] and don't put the [unclear]white[/unclear] out here?",black,253,[unclear]awful[/unclear],awful
"i don't think much of army life, it is [unclear]awful[/unclear] poor. colored soldiers   are usually  segregated on trains  as we have to [unclear]leave[/unclear] all southern state officers and only a few northern states. why do they put us out here in this [unclear]desert[/unclear] and don't put the [unclear]white[/unclear] out here?",black,253,[unclear]leave[/unclear],leave
"i don't think much of army life, it is [unclear]awful[/unclear] poor. colored soldiers   are usually  segregated on trains  as we have to [unclear]leave[/unclear] all southern state officers and only a few northern states. why do they put us out here in this [unclear]desert[/unclear] and don't put the [unclear]white[/unclear] out here?",black,253,[unclear]desert[/unclear],desert
"i don't think much of army life, it is [unclear]awful[/unclear] poor. colored soldiers   are usually  segregated on trains  as we have to [unclear]leave[/unclear] all southern state officers and only a few northern states. why do they put us out here in this [unclear]desert[/unclear] and don't put the [unclear]white[/unclear] out here?",black,253,[unclear]white[/unclear],white
and [unclear]reace[/unclear] would like to get in the [unclear]north [/unclear] i was basse tehre and i understan [unclear]rerere[/unclear] better then i did in the south. and i would hold any them am my cast i [unclear]cacl [/unclear] get it off and i would like to get in the north very much,black,265,[unclear]reace[/unclear],race
and [unclear]reace[/unclear] would like to get in the [unclear]north [/unclear] i was basse tehre and i understan [unclear]rerere[/unclear] better then i did in the south. and i would hold any them am my cast i [unclear]cacl [/unclear] get it off and i would like to get in the north very much,black,265,[unclear]north [/unclear],north
and [unclear]reace[/unclear] would like to get in the [unclear]north [/unclear] i was basse tehre and i understan [unclear]rerere[/unclear] better then i did in the south. and i would hold any them am my cast i [unclear]cacl [/unclear] get it off and i would like to get in the north very much,black,265,[unclear]rerere[/unclear],
and [unclear]reace[/unclear] would like to get in the [unclear]north [/unclear] i was basse tehre and i understan [unclear]rerere[/unclear] better then i did in the south. and i would hold any them am my cast i [unclear]cacl [/unclear] get it off and i would like to get in the north very much,black,265,[unclear]cacl [/unclear],
"1. some thing should be done about how the soldiers or treated (colord) in the south 2. the colord officers dont have a chance to advance 3. their should be more colord commanders in the (div) most of the white officers or not fair to the colord 4. i heard one of the majors say he did'nt like a neger, becaus a neger kild his dad. he should be in a white [unclear]camps[/unclear] 5. how can the colord be any better after the war whe they cant get a (des) job know 6. the colord would love to fight if they had [unclear](eoc)[/unclear] wrights 7. a colord soldier is not given credit for what he do [unclear](lac)[/unclear] to the white",black,267,[unclear]camps[/unclear],camps
"1. some thing should be done about how the soldiers or treated (colord) in the south 2. the colord officers dont have a chance to advance 3. their should be more colord commanders in the (div) most of the white officers or not fair to the colord 4. i heard one of the majors say he did'nt like a neger, becaus a neger kild his dad. he should be in a white [unclear]camps[/unclear] 5. how can the colord be any better after the war whe they cant get a (des) job know 6. the colord would love to fight if they had [unclear](eoc)[/unclear] wrights 7. a colord soldier is not given credit for what he do [unclear](lac)[/unclear] to the white",black,267,[unclear](eoc)[/unclear],
"1. some thing should be done about how the soldiers or treated (colord) in the south 2. the colord officers dont have a chance to advance 3. their should be more colord commanders in the (div) most of the white officers or not fair to the colord 4. i heard one of the majors say he did'nt like a neger, becaus a neger kild his dad. he should be in a white [unclear]camps[/unclear] 5. how can the colord be any better after the war whe they cant get a (des) job know 6. the colord would love to fight if they had [unclear](eoc)[/unclear] wrights 7. a colord soldier is not given credit for what he do [unclear](lac)[/unclear] to the white",black,267,[unclear](lac)[/unclear],
same times is verry hard when yau came aff a thirty miles [unclear]hike[/unclear] and yaur feets ar hurting. you go to the dactar and he gives yau a small bax of arspin to take. when ever you get ready to go some place yau have to get a pass and mast af the time they want give you and. after saldering hard frame manday marning until satureday noan.  this is the reason i saw that negro shauld get a fair chance after the war is aver. the negroes aut hear go aut in the mauntain and sleep in the snaw and rain try to get ready far the battle he try to make things [unclear]easy[/unclear] far the peaples in civilans better far them.,black,270,[unclear]hike[/unclear],hike
same times is verry hard when yau came aff a thirty miles [unclear]hike[/unclear] and yaur feets ar hurting. you go to the dactar and he gives yau a small bax of arspin to take. when ever you get ready to go some place yau have to get a pass and mast af the time they want give you and. after saldering hard frame manday marning until satureday noan.  this is the reason i saw that negro shauld get a fair chance after the war is aver. the negroes aut hear go aut in the mauntain and sleep in the snaw and rain try to get ready far the battle he try to make things [unclear]easy[/unclear] far the peaples in civilans better far them.,black,270,[unclear]easy[/unclear],easy
just the fact it  the most of the white people in the [unclear] war [/unclear] don't seem to want us in the war. or they that is the  they   for any part i that every one of those kind of people could be sent over the  and made to fight for their life. and i also  i could get a bunch of them and have whip them until they could not stand up. the each  are not even worth talking about or even writing about,black,282,[unclear] war [/unclear],war
i think that after this war this country should be a better place for every one to live. i also think the negro should have more [unclear]pricler[/unclear] after the war and a better chance to make a living if we cant get these things what good will this fight will have done.,black,292,[unclear]pricler[/unclear],
the following questionnaire were very good. i wish i could tell just who i am and just what they and people out here are good for they one [unclear]every[/unclear] chicken shit don't no what it is to give you a [unclear]bash[/unclear]. i hope soon this war will be over then i may get a chance to see some of them where we can start up another war. this one will be a race war. i hope who will read this will be a white southern. all of the northern are way good to the soldiers. this will be seen from a bad soldier. (smile),black,294,[unclear]every[/unclear],
the following questionnaire were very good. i wish i could tell just who i am and just what they and people out here are good for they one [unclear]every[/unclear] chicken shit don't no what it is to give you a [unclear]bash[/unclear]. i hope soon this war will be over then i may get a chance to see some of them where we can start up another war. this one will be a race war. i hope who will read this will be a white southern. all of the northern are way good to the soldiers. this will be seen from a bad soldier. (smile),black,294,[unclear]bash[/unclear],
"after being promised my release after 1 year of service i was kept and many soldiers release who hadn't had seven months of training just because they were 28 or over. ill [i'll] always feel that i was dealt with unjustly  i would have been  to return after pearl harbor.  this army  business in the  if the government can't protect her soldiers no matter what color how do [does] she expect them to want to protect her. stop civilian cops from mistreating colored soldiers in the south.  going south soon if  molested in anyway there will be  and plenty. why isnt [isn't] there more paper to write on? in an isolated camp as mine any is there such a thing as bed check? most   on weekend alone and 10,  soldiers heading for a town that can afford recreation of only 50. something should be done. why isn't home built around here for enlisted men and there [their] families? the only women around here aren't fit society for the japs and germans. for an all colored post it's pretty lightly colored. [unclear]see [/unclear]decent house belong to civilians why can't soldiers own them? why?i'm expecting combat duty soon this country had better make her promise good or we'll have another war within two years but with all her faults i love her.",black,301,[unclear]see [/unclear],
there isn't much to comment upon only the [unclear]practiced[/unclear] hatred in the camps and public conveyances toward the negro these are the main questions we are confronted with right at this present time. it might be state laws to discriminate but it should be discontinued in our army camps.,black,302,[unclear]practiced[/unclear],practiced
this is reason why i want to  [unclear]wont[/unclear] work,black,317,[unclear]wont[/unclear],
i have no comments about [unclear]bio[/unclear] questionnaire but i hope it will do so good,black,335,[unclear]bio[/unclear],
i think this is a very good test for the army to no what the boy in the [unclear]al[/unclear] done and how they are treating,black,344,[unclear]al[/unclear],
i think this a very good questionnaire book because it gives us as negros to express our feeling about this war. in my mind i see that we are going to win this war. we have a great nation one that have all ways stood tops among other nations & all ways will we have the strength but there are something we have to curb & that is that feeling one toward a nother as the two races work together in winning this war. after the war [unclear]louge[/unclear] or should believe that the to races will be more loving and mould their great nation in to a more greater nation than befor.,black,370,[unclear]louge[/unclear],
i myself perfect [unclear]so the[/unclear] by there are something the negro should have a right to do as a army for as a white [unclear]rose[/unclear] for shoseld. all camp together it will make the negro [unclear]ace[/unclear] field that they have a right to fight. but as it is now as a megro just as soon serve under one jim crow are another the govement could treat you any cause the white people have. the office here think as a negro should take of this else and put them to bed and serve them in the bed. you think we as a negro field like to give our life for the [unclear]brook[/unclear] of future that nice have here i do not field that i should.,black,385,[unclear]so the[/unclear],
